"","changes","firstReleased","langID","partLabel","lastUpdated","partDesc","partID","partInstr","notes"
"1237","added in V2.0","2.0","eng","Date de la dernière mise à jour","2.0","La date à laquelle la partie a été mise à jour pour la dernière fois.","lastUpdated","Toute modification de la liste des parties entraînera une mise à jour du champ lastUpdated à la version du dictionnaire où la mise à jour a eu lieu.",NA
"1238","added in V2.0","2.0","fra","Colonne d'expression Latext","2.0","Expression Latext utilisée pour générer des formules mathématiques pour les unités.","latExp","Uniquement pertinent pour les unités, les autres parties n'en auront pas.",NA
"1239","added in V2.0","2.0","eng","Groupe d'attributs divers","2.0","Un groupe d'attributs divers de type mesure.","miscAttr","Il s'agit par exemple de la longitude et de la latitude, ou des coordonnées EPSG.",NA
"1240","added in V2.0","2.0","fra","Groupe de mesures divers","2.0","Un groupe de mesures qui ne peuvent pas être classées dans une autre catégorie.","miscMeas","NA",NA
"1241","added in V2.0","2.0","eng","Type de partie d'absence","2.0","Le type de partie pour les valeurs manquantes.","missingness","Utilisé uniquement pour les entrées du dictionnaire relatives aux parties.",NA
"1242","added in V2.0","1.0","fra","Échantillon mélangé/homogénéisé","2.0","échantillon homogénéisé/mélangé.","mix","NA",NA
"1243","added in V2.0","2.0","eng","Millilitres","2.0","Millilitres de volume.","ml","NA",NA
"1244","added in V2.0","2.0","fra","Mégalitres par jour","2.0","Mégalitres par jour.","mld","NA",NA
"1245","added in V2.0","1.1","eng","Millimètres","2.0","Partie d'unité pour l'unité SI des millimètres.","mm","NA",NA
"1246","added in version 2","2.0","fra","Population desservie","2.0","Un attribut d'un site, qui spécifie la population de/desservie par un site donné.","popServ","NA",NA
"1247","added in V2.0","1.0","eng","Échantillon passif avec écouvillon de Moore","2.0","Un échantillon passif collecté par la méthode de Moore.","moorSw","NA",NA
"1248","added in V2.0","2.0","fra","Mètre pas seconde","2.0","Mètre pas seconde","ms","NA",NA
"1249","added in V2.0","2.0","eng","coliphage ms2","2.0","Mesure de la quantité de coliphage ms2.","ms2Col","NA",NA
"1250","added in V2.0","2.0","fra","Cible de coliphage ms2","2.0","Le coliphage ms2 est utilisé comme cible de contrôle de l'efficacité de la récupération.","ms2ColMat","NA",NA
"1251","added in V2.0","2.0","eng","Double de matrice enrichie","2.0","Des quantités connues d'un analyte ou de composés représentatifs sont ajoutées en laboratoire à une seconde aliquote de l'échantillon utilisé pour le matriçage.","msd","NA",NA
"1252","added in V2.0, depreciated after","1.0","fra","Échantillon passif avec écouvillon de Moore","2.0","Un échantillon passif collecté par la méthode de Moore.","msps","NA",NA
"1253","added in V2.0","1.0","eng","Principale canalisation d'égout","2.0","Collecteur d'égouts.","mSwrPpl","NA",NA
"1254","added in V2.0","2.0","fra","Mu","2.0","B.1.621","mu","NA",NA
"1255","added in V2.0","2.0","eng","coronavirus murin","2.0","Mesure de la quantité de coronavirus murin.","muCo","NA",NA
"1256","added in V2.0","2.0","fra","Cible du coronavirus murin","2.0","Le coronavirus murin est utilisé comme cible de contrôle de l'efficacité de la récupération.","muCoMat","NA",NA
"1257","added in V2.0","2.0","eng","Fraction multiple","2.0","Les fractions multiples ont été analysées séparément et regroupées après analyse.","mul","Cet identifiant de fraction est destiné à être utilisé pour les données d'archives et ne doit pas être utilisé pour les nouvelles fractions ajoutées à l'avenir (2022). Veuillez également préciser dans la section des notes quelles fractions ont été utilisées pour les fractions multiples (ex. solide et liquide) afin d'éviter toute perte d'information.",NA
"1258","added in V2.0","2.0","fra","Objectifs multiples","2.0","Une mesure ou un échantillon prélevé à des fins multiples, qui n'est pas facile à saisir dans les autres catégories d'objectifs.","multiple","Utile pour les échantillons parentaux où divers sous-échantillons auront des objectifs différents.",NA
"1259","added in V2.0","2.0","eng","Établissement de soins de longue durée - vie assistée ou maison de retraite","2.0","Un établissement résidentiel qui fournit une assistance pour les soins quotidiens mais qui ne fournit généralement pas de soins infirmiers qualifiés.","ltcfAl","NA",NA
"1260","added in V2.0","2.0","fra","Classe de mutations","2.0","Spécifie une collection de mesures/méthodes liées aux mutations.","mutation","NA",NA
"1261","added in V2.0","2.0","eng","Gène ciblé N de SRAS-CoV-2","2.0","Gène cible N de SRAS-CoV-2.","n","NA",NA
"1262","added in V2.0","2.0","fra","Cible génique combinée N1 et N2 sars-cov-2","2.0","Gène cible combiné N1 et N2 de SRAS-CoV-2.","n1n2","NA",NA
"1263","added in V2.0","2.0","eng","Gène ciblé n211i de la variante omicron","2.0","Gène cible n211i de la variante omicron.","n211i ","NA",NA
"1264","added in V2.0","2.0","fra","Gène ciblé n679k de la variante omicron","2.0","Gène cible n679k de la variante omicron.","n679k ","NA",NA
"1265","added in V2.0","2.0","eng","Gène ciblé n856k de la variante omicron","2.0","Gène cible n856k de la variante omicron.","n856k ","NA",NA
"1266","added in V2.0","2.0","fra","Gène ciblé n969k de la variante omicron","2.0","Gène cible n969k de la variante omicron.","n969k ","NA",NA
"1267","added in V2.0","1.0","eng","Non applicable","2.0","Le champ pour lequel la valeur attendue n'est pas une propriété de l'objet décrit.","na","Indicateur de valeur manquante pour les données manquantes sans explication.",NA
"1268","added in V2.0","2.0","fra","Agrégations non applicable","2.0","Non applicable pour les agrégations.","naAggr","Utilisé pour les parties pour lesquelles une valeur d'agrégation n'est pas applicable ou appropriée.",NA
"1269","added in V2.0","2.0","eng","Échelle d’agrégations non applicable","2.0","Non applicable pour les ensembles d'agrégations.","naAggrScale","Utilisé pour les parties pour lesquelles une valeur d'échelle d'agrégation n'est pas applicable ou appropriée.",NA
"1270","added in V2.0","2.0","fra","Ensemble d’agrégations non applicable","2.0","Non applicable pour les ensembles d'agrégations.","naAggrSet","Utilisé pour les parties pour lesquelles un ensemble d'agrégations n'est pas applicable ou approprié.",NA
"1271","added in V2.0","2.0","eng","Classe non applicable","2.0","Spécifie une classe pour les parties où une classe n'est pas applicable ou appropriée.","naClass","Utilisez ceci pour toutes les parties qui n'ont pas de classes (la plupart des parties qui ne sont pas des mesures ou des méthodes).",NA
"1272","added in version 2","2.0","fra","Ensemble de catégories de matériaux d'échantillon","2.0","Ensemble de catégories pour les types de matières qui peuvent être trouvées dans un échantillon.","sampleMatCatSet","NA",NA
"1273","added in version 2","2.0","eng","Ensemble de catégories pour le bassin d'échantillonnage","2.0","L'ensemble de catégories contenant toutes les valeurs valides de sampleshed.","shedCatSet","NA",NA
"1274","added in V2.0","2.0","fra","Domaine non applicable","2.0","Non applicable.","naDomain","Utilisez ""non applicable"" lorsqu'il n'y a pas de domaine pour la partie.",NA
"1275","added in V2.0","2.0","eng","Groupe non applicable","2.0","Non applicable.","naGroup","Utilisez ""non applicable"" lorsqu'il n'y a pas de groupe pour la pièce.",NA
"1276","added in V2.0","2.0","fra","Responsable des données","2.0","Le gestionnaire des données d'une base de données.","custodyID","Utilisez Organisation pour décrire les coordonnées et autres détails du dépositaire des données.",NA
"1277","added in V2.0","1.0","eng","Pas un numéro","2.0","Le résultat d’une mesure n’est pas un numéro valide (plus ou moins l'infini, une erreur, …)","nan","Indicateur de valeurs manquantes lorsqu'une valeur numérique est attendue mais n'est pas donnée.",NA
"1278","added in V2.0","2.0","fra","Nomenclature non applicable","2.0","Non applicable.","naNomenclature","Utilisez ""sans objet"" lorsqu'il n'y a pas de nomenclature pour la pièce.",NA
"1279","added in V2.0","2.0","eng","Spécimen non applicable","2.0","Non applicable.","naSpecimen","Utilisez ""non applicable"" lorsqu'il n'y a pas de spécimen pour la partie.",NA
"1280","added in version 2","2.0","fra","Ensemble de catégories de sites","2.0","Ensemble de catégories pour le type de site d'échantillonnage.","siteTypeCatSet","NA",NA
"1281","added in V2.0","2.0","eng","Nom natif de la langue","2.0","Le nom natif de la langue, c'est-à-dire le nom donné à la langue par ses locuteurs.","natName","Partie des metedata d'un languageID.",NA
"1282","added in V2.0","2.0","fra","Unité non applicable","2.0","Non applicable pour les unité.","naUnit","NA",NA
"1283","added in V2.0","2.0","eng","Ensemble d’unité non applicable","2.0","Non applicable pour les ensembles d'unité.","naUnitSet","NA",NA
"1284","added in V2.0","2.0","fra","ND","2.0","Aucune amplification n'a eu lieu dans la réaction ; non-détection.","ND","Pour la valeur d'une mesure non détectée, rapportez la valeur réelle même si elle est inférieure au seuil de détection. L'indicateur permet de s'assurer que la mesure est enregistrée comme non détectée. Dans les cas où les données originales n'enregistrent pas de valeur, mais seulement l'indicateur, veuillez remplir le champ de valeur avec un 1 ou un 0 pour indiquer un résultat nul.",NA
"1285","added in V2.0","2.0","eng","Autres soins de longue durée","2.0","Autres établissements résidentiels qui fournissent des soins quotidiens et/ou médicaux, mais qui ne sont pas définis comme des maisons de soins infirmiers/établissements de soins qualifiés ou des établissements de vie assistée.","ltcfO","NA",NA
"1286","added in V2.0","2.0","fra","Population des personnes nouvellement vaccinées","2.0","Population des personnes nouvellement vaccinées","newVax","NA",NA
"1287","added in V2.0","2.0","eng","Nomenclature NextClade","2.0","Spécifie la nomenclature variante ou génétique telle que définie par NextClade.","nextclade","NA",NA
"1288","added in V2.0","1.0","fra","Moyenne géométrique normalisée","2.0","Moyenne géométrique normalisée.","ngmn","NA",NA
"1289","added in V2.0","1.0","eng","Azote Ammoniacal","2.0","Concentrsation d'azote ammoniacal, exprimé en N.","nH4N","NA",NA
"1290","added in V2.0","2.0","fra","Gène ciblé niid_2019-ncov_n de SRAS-CoV-2","2.0","Gène cible niid_2019-ncov_n de SRAS-CoV-2.","niid19","NA",NA
"1291","added in V2.0","2.0","eng","AucunProblèmeRCP","2.0","Aucun problème de qualité à noter pour la réaction RCP.","noConcernPCR","NA",NA
"1292","added in V2.0","2.0","fra","Échantillon non étiqueté","2.0","L'échantillon n'avait pas d'étiquette","noLabel","NA",NA
"1293","added in V2.0","2.0","eng","Pas de concentration du liquide, le liquide est recombiné avec les solides séparés.","2.0","Pas de concentration du liquide, le liquide est recombiné avec les solides séparés.","noliquid","NA",NA
"1294","added in V2.0","2.0","fra","Type de nomenclature","2.0","Un système de classification pour rendre compte de la classe de mesures.","nomenclature","Voir partID = nomenclatureID.",NA
"1295","added in V2.0","2.0","eng","Longueur maximale","2.0","La longueur minimale d'une partie.","maxLength","NA",NA
"1296","added in V2.0","2.0","fra","Unité non détectée","2.0","Identificateur d'unité pour le cas où une mesure est ""non détectée"" afin d'expliquer une valeur de zéro.","nondet","Utiliser cette unité dans les cas où une mesure n'a donné lieu à aucune détection.",NA
"1297","added in V2.0","1.0","eng","Adresse courriel de contact.","2.0","Adresse courriel de contact pour le laboratoire.","email","NA",NA
"1298","added in V2.0","2.0","fra","Échantillon sans horodatage","2.0","Il manque l'heure du passeur d'échantillons ; métadonnées incomplètes sur le prélèvement.","noTime","NA",NA
"1299","added in V2.0","1.0","eng","Non rapporte","2.0","Une valeur aurait pu être enregistrée, cependant elle ne l'a pas été.","nr","Indicateur de valeur manquante pour les données qui sont absentes parce qu'elles n'ont pas été déclarées.",NA
"1300","added in V2.0","2.0","fra","Gène cible de SRAS-CoV-2 sarbecovirus-spécifique N","2.0","Gène cible N de SRAS-CoV-2 spécifique du sarbecovirus","nSarbec","NA",NA
"1301","added in V2.0","2.0","eng","Unité de turbidité néphélométrique","2.0","Unités de turbidité néphélométrique, une unité utilisée dans la mesure de la turbidité (voir ""turbidité"" sous measureIDs).","ntu","Les unités de turbidité néphélométriques (NTU) sont basées sur la lumière blanche (400-680nm) et un angle d'incidence de 90°.",NA
"1302","added in V2.0","2.0","fra","Trousse d'extraction automatique de billes magnétiques nuclisens","2.0","Extraction d'acides nucléiques réalisée à l'aide de la trousse d'extraction automatique de billes magnétiques nuclisens.","nucAuto","NA",NA
"1303","added in V2.0","2.0","eng","Trousse d'extraction manuelle de billes magnétiques nuclisens","2.0","Extraction d'acides nucléiques réalisée à l'aide de la trousse d'extraction manuelle de billes magnétiques nuclisens.","nucManu","NA",NA
"1304","added in V2.0","1.0","fra","Type d'échantillon d'eau","2.0","Eau non-usée provenant de toute étendue d'eau.","nww","NA",NA
"1305","added in V2.0","2.0","eng","coronavirus OC43","2.0","Mesure de la quantité de coronavirus OC43.","oc43","NA",NA
"1306","added in V2.0","2.0","fra","Cible de oc43","2.0","Le coronavirus humain OC43 est utilisé comme cible de contrôle de l'efficacité de la récupération.","oc43Mat","NA",NA
"1307","added in V2.0","1.0","eng","Océan, plan d'eau naturelle","2.0","Océan, étendue d'eau naturelle.","ocean","NA",NA
"1308","added in V2.0, depreciated after","1.0","fra","Autre collection","2.0","Autre méthode de collecte. Ajouter une description dans la colonne ""descriptionOther""","oCol","NA",NA
"1309","added in V2.0","1.0","eng","Analyse en laboratoire","2.0","Analyse en laboratoire.","ola","NA",NA
"1310","added in V2.0","2.0","fra","Omicron","2.0","B.1.1.529","omicr","NA",NA
"1311","added in V2.0; depreciated","1.0","eng","Date de l'apparition","2.0","Date à laquelle les premiers symptémes apparaissent. Cette donnée est souvent inconnue. La date d'épisode est alors communément utilisée.","onsDate","NA",NA
"1312","added in V2.0","1.0","fra","Capteur en direct","2.0","Capteur en ligne.","onse","NA",NA
"1313","added in V2.0","1.0","eng","Orthophosphates","2.0","Orthophosphates","ophos","NA",NA
"1314","added in V2.0","2.0","fra","Municipalité","2.0","Une municipalité complète, c'est-à-dire une zone métropolitaine entière, soit une ville, un village, etc.","municp","NA",NA
"1315","added in V2.0","2.0","eng","Gène cible ORF1a de SRAS-CoV-2","2.0","Gène cible ORF1a de SRAS-CoV-2","orf1a","NA",NA
"1316","added in V2.0","2.0","fra","Gène cible ORF1ab de SRAS-CoV-2","2.0","Gène cible ORF1ab de SRAS-CoV-2","orf1ab","NA",NA
"1317","added in V2.0","2.0","eng","Gène cible ORF1b de SRAS-CoV-2","2.0","Gène cible ORF1b de SRAS-CoV-2","orf1b","NA",NA
"1318","description wording, structure","1.0","fra","Numéro de téléphone de contact","2.0","Numéro de téléphone de contact.","phone","NA",NA
"1319","added in V2.0","2.0","eng","Valeur maximale dictionnaire","2.0","La valeur maximale d'une partie.","maxValue","NA",NA
"1320","added in V2.0, depreciated after","2.0","fra","Table de types d'organisation","2.0","La table qui contient de l'information sur les types d'organisation.","organizationTypes","NA",NA
"1321","added in version 2","2.0","eng","Ensemble de catégories de séparation des solides","2.0","Ensemble de catégories pour la séparation des solides.","solidSeparationCatSet","NA",NA
"1322","none","1.0","fra","Type d'instrument","2.0","Type d'instrument utilisé pour effectuer la mesure.","insType","NA",NA
"1323","added in V2.0","2.0","eng","Origine de l'échantillon","2.0","Un attribut d'un échantillon spécifiant l'origine.","origin","NA",NA
"1324","added in version 2","2.0","fra","Ensemble de catégories pour matrice enrichie","2.0","CatSetégories pour spikeMat (matrices dans lesquelles la cible de contrôle de l'efficacité de la récupération est injectée).","spikeMatCatSet","NA",NA
"1325","added in V2.0, depreciated after","1.0","eng","Autre collection","2.0","Autre méthode de collecte. Ajouter une description dans la colonne ""descriptionOther""","otco","NA",NA
"1326","added in V2.0","2.0","fra","Ensemble d'agrégation - autres","2.0","Ensemble d'agrégations pour les mesures sans unité.","otherAggrSet","NA",NA
"1327","added in V2.0, depreciated after","1.0","eng","Agrégation, autre","2.0","Autre méthode d'agrégation. Ajouter une description dans ""aggregationOther"".","otherDep","NA",NA
"1328","added in V2.0, depreciated after","1.0","fra","Accès aux Autres Provinces","2.0","Si ""Non"", la donnée ne sera pas accessible par les autorités de santépublique provinciales. Si ""Oui"" ou laissé vide, la donnée leur sera accessible.","otherProv","NA",NA
"1329","added in V2.0, depreciated after","1.0","eng","Autre site","2.0","Autre catégorie de mesure. Ajouter une description de la catégorie dans la colonne ""categoryOther"".","otsiDep2","NA",NA
"1330","added in V2.0, depreciated after","1.0","fra","Autre site","2.0","Autre type de site d'échantillonnage. Ajouter une description dans la colonne ""typeOther""","otsiDep2","NA",NA
"1331","added in V2.0, depreciated after","1.0","eng","Autre unité","2.0","Autre mesure de copies virales ou de qualité des eaux usées. Ajouter une description dans ""unitOther"".","otun","NA",NA
"1332","added in V2.0","2.0","fra","Outbreak","2.0","Mesure pour indiquer le statut de l'outbreak. Étant donné qu'en cas des outbreak, il se peut que les données complètes sur le nombre de cas ne soient pas disponibles ou complètement exactes, l'utilisation de cette mesure indique que le nombre de cas peut être approximatif.","outb","La date de la mesure permet d'indiquer les périodes de début et de fin d'une outbreak.",NA
"1333","added in V2.0","2.0","eng","Fin du outbreak","2.0","Indique qu'un outbreak a pris fin.","outbEnd","NA",NA
"1334","added in V2.0","2.0","fra","Outbreak en cours","2.0","Indique qu'un outbreak est en cours.","outbOngoing","NA",NA
"1335","added in version 2","2.0","eng","Ensemble de catégories pour l'efficacité de la récupération de la matiére enrichie","2.0","L'ensemble de catégories contenant toutes les catégories valides pour la cible de contrôle de l'efficacité de la récupération (ou de matrice enrichie).","spikeTargetCatSet","NA",NA
"1336","added in V2.0","2.0","fra","Début du outbreak","2.0","Indique qu'un outbreak a commencé.","outbStart","NA",NA
"1337","added in V2.0","2.0","eng","Gène cible p100l de la variante delta","2.0","Gène cible p100l de la variante delta.","p100l","NA",NA
"1338","added in V2.0","2.0","fra","Gène cible p2046l de la variante delta","2.0","Gène cible p2046l de la variante delta.","p2046l","NA",NA
"1339","added in V2.0","2.0","eng","Gène cible p2287s de la variante delta","2.0","Gène cible p2287s de la variante delta.","p2287s","NA",NA
"1340","added in V2.0","2.0","fra","Gène cible p3395h de la variante omicron","2.0","Gène cible p3395h de la variante omicron.","p3395h ","NA",NA
"1341","added in V2.0","2.0","eng","Gène cible p681r de la variante delta","2.0","Gène cible p681r de la variante delta.","p681r","NA",NA
"1342","added in V2.0","2.0","fra","Nomenclature Pangolin","2.0","Spécifie la nomenclature variante ou génétique telle qu'elle est définie par l'attribution phylogénétique des lignées d'éclosions mondiales nommées (Pangolin).","pangolin","NA",NA
"1343","added in version 2","2.0","eng","Type de réplicat","2.0","Attribut d'un échantillon, spécifiant si l'échantillon est unique, ou une réplique. Et s'il s'agit d'une réplique, de quel type de réplique s'agit-il ?","repType","NA",NA
"1344","added in V2.0","2.0","fra","Quartier général","2.0","Un quartier municipal, qui spécifie une sous-section d'une municipalité plus grande.","neigh","NA",NA
"1345","added in V2.0","1.0","eng","Table de rapport de mesure","2.0","La table qui contient de l'information et des détails sur une mesure donnée.","measures","NA",NA
"1346","added in V2.0","1.0","fra","Table de rapport des ensembles de mesures","2.0","La table qui identifie les ensembles de mesures.","measureSets","NA",NA
"1347","added in V2.0","2.0","eng","L’ordre des colonnes de la Table d'ensemles de mesure","2.0","Indique l’ordre des colonnes dans une Table d'ensembles de mesure.","measureSetsOrder","NA",NA
"1348","added in V2.0","2.0","eng","Exigences de la Table d'ensembles de mesure","2.0","Indique les colonnes requises dans une Table d'ensembles de mesure.","measureSetsRequired","NA",NA
"1349","added in V2.0","2.0","fra","L’ordre des colonnes de la Table de mesures","2.0","Indique l’ordre des colonnes dans une Table de mesures.","measuresOrder","NA",NA
"1350","added in V2.0","2.0","fra","Exigences de la Table de mesures","2.0","Indique les colonnes requises dans une Table de mesures.","measuresRequired","NA",NA
"1351","added in version 2","2.0","eng","Ensemble de catégories de colonnes de table","2.0","L'ensemble des catégories pour les entrées valides dans les colonnes des tableaux.","tableCatSet","Ces catégories sont utilisées dans la liste des parties pour des colonnes portant le nom de tables afin d'indiquer la position et la fonction d'une partie donnée dans le diagramme entité-relation du modèle de données.",NA
"1352","depreciated","1.0","eng","Effluent primaire du clarificateur","2.0","Effluent obtenu aprés un décanteur primaire.","pce","NA",NA
"1353","description wording","1.0","fra","Uses multiple fields in SARS-CoV-2 Quantification method","2.0","Description de la méthode RCP.","pcr","Description de la méthode RCP utilisée",NA
"1354","added in version 2","2.0","fra","Ensemble2QualitéRCP","2.0","Ensemble de qualité pour les mesures de RCP.","pcrQualitySet","NA",NA
"1355","depreciated","1.0","eng","Boues du clarificateur primaire","2.0","Boue provenant d'un décanteur primaire.","pcs","NA",NA
"1356","NA","1.0","fra","Effluent du décanteur primaire","2.0","Effluent obtenu aprés un décanteur primaire.","pEfflu","NA",NA
"1357","added in version 2","2.0","eng","Précipitation au polyéthylèneglycol (PEG)","2.0","Précipitation au polyéthylèneglycol (PEG)","peg","NA",NA
"1358","added in version 2","2.0","eng","Pour cent","2.0","Pourcentage.","perc","NA",NA
"1359","description wording, structure","1.0","fra","Pourcentage de récupération","2.0","Pourcentage de la récupération de substitution pour un essai de contrôle de l'efficacité de la récupération.","percRec","Sert à rapporter les résultats de tout essai de contrôle de récupération.",NA
"1360","description wording, structure","1.1","fra","pH","2.0","pH","ph","NA",NA
"1361","Depreciated.","1.0","eng","Accès à PHAC","2.0","Si ""Non"", la donnée ne sera pas accessible par les employés de l'Agence de Santé Publique du Canada. Si ""Oui"" ou laissé vide, la donnée leur sera accessible.","phac","NA",NA
"1362","NA","1.0","fra","Latitude géographique","2.0","Position géographique du site d'échantillonnage. Latitude exprimée en coordonnées décimales (ex. 45.424721)","geoLat","NA",NA
"1363","added in version 2","2.0","eng","Phénol chloroforme","2.0","Extraction d'acides nucléiques réalisée avec du chloroforme phénol.","phenCl","NA",NA
"1364","added in version 2","2.0","fra","Virus Pseudomonas phi6","2.0","Mesure de la quantité de virus pseudomonas phi6.","phi6","NA",NA
"1365","added in version 2","2.0","eng","Cible de phi6","2.0","Le virus Pseudomonas phi6 est utilisé comme cible de contrôle de l'efficacité de la récupération.","phi6Mat","NA",NA
"1366","added in version 2","2.0","fra","Rôle du contact","2.0","Précise le rôle organisationnel d'un contact donné.","role","NA",NA
"1367","description wording, structure","1.1","eng","Phosphore total","2.0","Phosphore total","phos","NA",NA
"1368","description wording, structure","1.1","fra","Phosphates totaux","2.0","Phosphates totaux.","phostot","NA",NA
"1369","added in version 2","2.0","eng","Propriété Physique","2.0","Propriété qui n'est pas spécifiée par la composition chimique ou la présence de vie.","phy","NA",NA
"1370","added in version 2","2.0","fra","Classe physique","2.0","Spécifie une collection de mesures/méthodes liées à des propriétés physiques génériques.","physical","NA",NA
"1371","added in version 2","2.0","eng","Clé primaire","2.0","Clé primaire pour une table.","pK","NA",NA
"1372","added in version 2","2.0","fra","Moyenne normalisée en fonction du débit et du PMMoV","2.0","Mesure moyenne normalisée à la quantité de PMMoV et au débit d'eaux usées ; AllèleX (gc/mL) x Q (ML/d) / (Pop /1e5) x 1e3 (mL/L) x 1e6 (L/ML) = AllèleX (gc/jour par 1e5 population)","pmFloMean","Principalement utilisé pour déclarer des allèles spécifiques (N1, N2, E, etc.)",NA
"1373","added in version 2","2.0","eng","Moyenne normalisée en fonction du PMMoV","2.0","Mesure moyenne normalisée par rapport à la quantité de PMMoV.","pmmovNorm","Principalement utilisé pour signaler des allèles spécifiques (N1, N2, E, etc.).",NA
"1374","added in version 2","1.0","fra","Population","2.0","Mesure aggrégée de santé publique","po","NA",NA
"1375","depreciated","1.0","eng","Post-gravillonnage","2.0","Eau usée aprés dégrillage et dessablage.","pogr","NA",NA
