"","changes","firstReleased","langID","partLabel","lastUpdated","partDesc","partID","partInstr","notes"
"855","added in version 2","2.0","eng","Mid-level severity","2.0","A marker for med-level severity, where there are some concerns.","mid","NA",NA
"856","added in version 2","2.0","eng","High severity","2.0","Indicates a very sever quality issue, likely meaning the data should not be reported.","high","NA",NA
"857","added in version 2","2.0","eng","Severity Category Set","2.0","A category set for severity indicators.","sevCatSet","NA",NA
"858","added in version 2","2.0","eng","Lookup tables class","2.0","Specifies a class for lookup tables.","lookup","NA",NA
"859","added in V2.0","2.0","eng","Funder Contact ID","2.0","A unique identifier for funders.","funderCont","NA",NA
"860","added in V2.0","2.0","eng","Custody Contact ID","2.0","A unique identifier for data custodians.","custodyCont","NA",NA
"861","added in V2.0","2.0","eng","Short Names","2.0","A part list columns for recording extra shortened names for tables and other important parts for use in wide names.","shortName","NA",NA
"862","added in version 2","2.0","eng","General Missingness Set","2.0","The general set for missingness values.","genMissingnessSet","NA",NA
"863","added in version 2","2.0","eng","Boolean unit set","2.0","Unit set for boolean.","booleanUnitSet","NA",NA
"864","added in V2.0","2.0","eng","Protocol ID Subject","2.0","The subject of the relationship between one protocol and another protocol or step, within a given protocol ID container.","protocolIDSub","Populate this field using Protocol ID (partID = protocolID). Together with `protocolIDSub` or `stepIDSub` and `relationshipID` the row of `protocolRelationships` should say: [protocolIDSubject or stepIDSubject]  [relationshipID] [protocolIDObject or stepIDObject]. Ex: stepIDSubject  precedes protocolIDObject.",NA
"865","added in V2.0","2.0","eng","Step ID Subject","2.0","The subject of the relationship between one protocol step and another step or protocol, within a given protocol ID container.","stepIDSub","Populate this field using Protocol ID (partID = stepID). Together with `protocolIDSub` or `stepIDSub` and `relationshipID` the row of `protocolRelationships` should say: [protocolIDSubject or stepIDSubject]  [relationshipID] [protocolIDObject or stepIDObject]. Ex: stepIDSubject  precedes protocolIDObject.",NA
"866","added in version 2","2.0","eng","Quality Sets","2.0","The part type for quality sets.","qualitySet","Sets are lists of input values. Each input value within a set is a part (has a partID) that can be reused between sets. For example, a set A could contain the values of 'yes' and 'no'; and set B could contain the values of 'yes', 'no', and 'maybe.' partTypes with sets include aggregations, compartments, missingness, quality flags, specimens, and units. Measures with categories and dataTypes have their own specific category sets (catSetID) because their input values are unique and are not reused.",NA
"867","added in version 2","2.0","eng","Aggregation Sets","2.0","The part type for aggregation sets.","aggSet","Sets are lists of input values. Each input value within a set is a part (has a partID) that can be reused between sets. For example, a set A could contain the values of 'yes' and 'no'; and set B could contain the values of 'yes', 'no', and 'maybe.' partTypes with sets include aggregations, compartments, missingness, quality flags, specimens, and units. Measures with categories and dataTypes have their own specific category sets (catSetID) because their input values are unique and are not reused.",NA
"868","added in version 2","2.0","eng","Compartment Sets","2.0","The part type for compartment sets.","compSet","Sets are lists of input values. Each input value within a set is a part (has a partID) that can be reused between sets. For example, a set A could contain the values of 'yes' and 'no'; and set B could contain the values of 'yes', 'no', and 'maybe.' partTypes with sets include aggregations, compartments, missingness, quality flags, specimens, and units. Measures with categories and dataTypes have their own specific category sets (catSetID) because their input values are unique and are not reused.",NA
"869","added in version 2","2.0","eng","Specimen Sets","2.0","The part type for specimen sets.","specimenSet","Sets are lists of input values. Each input value within a set is a part (has a partID) that can be reused between sets. For example, a set A could contain the values of 'yes' and 'no'; and set B could contain the values of 'yes', 'no', and 'maybe.' partTypes with sets include aggregations, compartments, missingness, quality flags, specimens, and units. Measures with categories and dataTypes have their own specific category sets (catSetID) because their input values are unique and are not reused.",NA
"870","added in version 2","2.0","eng","Missingness Set","2.0","The part type for missingness sets.","missingnessSet","Sets are lists of input values. Each input value within a set is a part (has a partID) that can be reused between sets. For example, a set A could contain the values of 'yes' and 'no'; and set B could contain the values of 'yes', 'no', and 'maybe.' partTypes with sets include aggregations, compartments, missingness, quality flags, specimens, and units. Measures with categories and dataTypes have their own specific category sets (catSetID) because their input values are unique and are not reused.",NA
"871","added in V2.0","2.0","fra","Méthode 4s","2.0","Extraction d'acides nucléiques réalisée par la méthode 4s.","4s","NA",NA
"872","added in V2.0","2.0","fra","Ensemble de catégories pour le collecte d'échantillons","2.0","L'ensemble de catégories pour la collecte d'échantillons.","collectCatSet","NA",NA
"873","added in V2.0","2.0","fra","a1306s cible du gène variante delta","2.0","Gène cible a1306s de la variante delta.","a1306s","NA",NA
"874","added in V2.0","2.0","fra","a1918v cible du gène variante delta","2.0","Gène cible a1918v de la variante delta.","a1918v","NA",NA
"875","added in V2.0","2.0","fra","a2710t cible du gène variante omicron","2.0","Gène cible a2710t de la variante omicron.","a2710t","NA",NA
"876","added in V2.0","2.0","fra","a63t cible du gène variante omicron","2.0","Gène cible a63t de la variante omicron.","a63t","NA",NA
"877","added in V2.0","2.0","fra","a67v cible du gène variante omicron","2.0","Gène cible a67v de la variante omicron.","a67v","NA",NA
"878","description wording, structure","1.0","fra","Analyseur manuel","2.0","Mesure é l'aide d'un échantillonneur.","aas","NA",NA
"879","added in V2.0","2.0","fra","Humidité absolue","2.0","Mesure de l'humidité absolue, ou de la concentration de vapeur d'eau présente dans l'air ; fait partie d'une série de mesures météorologiques qui peuvent être utiles lors de la collecte d'échantillons provenant de sources extérieures.","absHum","NA",NA
"880","added in V2.0","2.0","fra","Ensemble d'unités d'humidité absolue","2.0","Ensemble d'unités pour les mesures d'humidité absolue.","absHumidUnitSet","NA",NA
"881","added in V2.0","2.0","fra","Organisation de type d'institution académique","2.0","La catégorie de type d'organisation utilisée pour les institutions universitaires ou les groupes de recherche.","academ","NA",NA
"882","now a unit for any group or biologic infection","1.0","fra","Nombre de cas actifs","2.0","Nombre de cas actifs.","acti","NA",NA
"883","added in V2.0","2.0","fra","actif","2.0","Indicateur permettant de dire qu'une pièce est en cours d'utilisation dans le modèle. Voir partID = status","active","NA",NA
"884","added in V2.0","1.0","fra","Date d'analyse","2.0","Date à laquelle la mesure a été effectuée au laboratoire.","aDate","NA",NA
"885","added in V2.0","1.0","fra","ID du rapport de mesure","2.0","Identifiant unique pour la mesure pour la table ""WWMeasurement""","measureRepID","NA",NA
"886","added in V2.0","1.1","fra","ID de l'échantillon parental","2.0","Si l'échantillon a été combiné à un plus grand échantillon, indiquer l'identifiant du plus grand échantillon.","parSampID","NA",NA
"887","added in V2.0","2.0","fra","ID du rapport de l'ensemble de protocoles","2.0","La clé composite générée en combinant l'ID de l'ensemble de protocoles et l'index de l'ensemble.","protocolIDContainer","NA",NA
"888","description wording, structure","1.1","fra","ID de l'instrument","2.0","Identifiant unique pour l'instrument de mesure.","instID","NA",NA
"889","NA","2.0","fra","Table d'adresses","2.0","La table qui contient de l'information sur les adresses.","addresses","NA",NA
"890","added in V2.0","2.0","fra","ID du site parentale","2.0","L'ID du site qui est le parent d'un autre site ; généralement, le sous-site est contenu dans le site parent.","parSiteID","Un exemple serait un test de surface dans un établissement de soins de longue durée. L'établissement de SLD serait le parentSiteID, et les différentes pièces/surfaces seraient les sous-sites ou les sites enfants.",NA
"891","added in V2.0","2.0","fra","Unité de filtration d'air","2.0","Unité de filtration ou de circulation d'air.","afu","L'unité est généralement équipée d'un ventilateur ou d'une soufflerie.",NA
"892","added in V2.0","2.0","fra","Agrégation","2.0","Mesures statistiques utilisées pour rendre compte d'une mesure. Chaque dataType qui est un nombre doit être rapporté avec une agrégation.","aggregation","NA",NA
"893","description wording, structure","1.1","fra","ID de l'échantillon","2.0","Identifiant unique pour l'échantillon. Suggestion:siteID-date-index.","sampleID","NA",NA
"894","added in V2.0","2.0","fra","L’ordre des colonnes de la Table d'adresses","2.0","Indique l’ordre des colonnes dans une Table d'échantillon.","addressesOrder","NA",NA
"895","added in V2.0","2.0","fra","Exigences de la Table d'adresses","2.0","Indique les colonnes requises dans une Table d'adresses.","addressesRequired","NA",NA
"896","added in V2.0","2.0","fra","AI","2.0","L'échantillon original était inhibé ; cependant, l'inhibition a été traitée par dilution. L'estimation de la concentration rapportée est le résultat actualisé après traitement de l'inhibition.","ai","NA",NA
"897","added in V2.0","2.0","fra","ID du contact","2.0","Un identifiant unique pour une personne de contact donnée.","contID","NA",NA
"898","added in V2.0","2.0","fra","Ensemble de catégories d'extraction d'acide nucléique","2.0","Ensemble de catégories utilisé pour stocker toutes les valeurs de catégories valides pour la méthode d'extraction de l'acide nucléique.","extractCatSet","NA",NA
"899","description wording, structure","1.0","fra","Température ambiante","2.0","Température ambiante.","airTemp","NA",NA
"900","added in V2.0","2.0","fra","Ensemble de catégories de fraction d'échantillon","2.0","Ensemble de catégories pour la fraction de l'échantillon (solide, liquide, etc.).","fractionCatSet","NA",NA
"901","depreciated","1.0","fra","Alias","2.0","Identifiants d'autres instruments présents dans la table qui sont similaires é l'instrument courant. Insérer sous forme de liste séparée par des virgules.","alias","NA",NA
"902","depreciated","1.0","fra","Alias ID","2.0","Identifiants d'autres méthodes d'analyse présentes dans la table qui sont similaires é la méthode courante. Insérer sous forme de liste séparée par des virgules.","aliasID","NA",NA
"903","added in V2.0","2.0","fra","Toutes les domains","2.0","Domaine qui précise qu'il peut s'appliquer à tous les domaines : biologique, chimique et physique.","allDo","NA",NA
"904","added in V2.0","2.0","fra","Classe d'allèles","2.0","Spécifie une collection de mesures/méthodes relatives aux allèles.","allele","NA",NA
"905","depreciated","1.0","fra","Accès à Tout","2.0","Si ""Non"", la donnée ne sera pas accessible par toute organisation partenaire. Si ""Oui"" ou laissé vide, la donnée leur sera accessible.","allOrgs","NA",NA
"906","added in V2.0","2.0","fra","Précipitation d'Aloh3","2.0","Précipitation d'Aloh3","aloh3","NA",NA
"907","depreciated","1.0","fra","ID méthode d'analyse par défaut","2.0","Identifiant de la méthode d'analyse utilisée par défaut quand une nouvelle mesure est créé par ce laboratoire. Se référer é la colonne ""assayMethodID"" dans la table ""AssayMethod""","amDef","NA",NA
"908","added in V2.0","2.0","fra","Ultrafiltration Amicon","2.0","Ultrafiltration Amicon","amiconUf","NA",NA
"909","added in V2.0","2.0","fra","Filtre Amicon, extrait avec MP96","2.0","Extraction de l'acide nucléique, généralement utilisée pour la fraction liquide d'un échantillon d'eau usée, en utilisant la filtration amicon et en utilisant un MP96 pour l'extraction finale.","amiMP96","NA",NA
"910","added in V2.0","2.0","fra","Ensemble de catégories géographiques","2.0","Ensemble de catégories pour les différents types de composants géographiques.","geoTypeCatSet","NA",NA
"911","added in V2.0","2.0","fra","Echantillon proportionnel à la surface","2.0","Un échantillon proportionnel au domaine.","areaPr","Utilisé pour les tests de surface.",NA
"912","added in V2.0","2.0","fra","Utilisation de l'amorce articV3","2.0","Mise en œuvre initiale d'une plateforme bioinformatique ARTIC pour le séquençage nanopore du nouveau coronavirus nCoV2019 ; amorce Artic Foundation v3.","articV3","NA",NA
"913","added in V2.0","2.0","fra","Utilisation de l'amorce articV4","2.0","Amorce de séquençage Artic V4 pour les COV et les VOI.","articV4","NA",NA
"914","depreciated","1.0","fra","ID de la procédure d'analyse","2.0","Crée un lien avec la table ""AssayMethod"" pour décrire la méthode employée pour effectuer la mesure. Utiliser l'identifiant de l'instrument pour des mesures non virales.","asId","NA",NA
"915","added in V2.0","2.0","fra","Attributs de la composante","2.0","Un attribut d'un domaine, d'un spécimen, d'un compartiment ou d'une table de rapport.","attribute","Les attributs sont l'une des trois principales composantes ou manières de rapporter les données de survie de l'environnement. Les deux autres composantes sont les mesures et les méthodes.",NA
"916","added in V2.0","2.0","fra","Niveaux de contamination à l'état de traces","2.0","Le résultat analytique peut être sujet à des ""traces"" de contamination ; l'analyte cible a également été détecté dans les contrôles négatifs lors du même passage que l'échantillon.","b","NA",NA
"917","added in V2.0","2.0","fra","Ensemble d'unités de bactéries","2.0","Ensemble d'unités pour les mesures liées aux bactéries.","bacterialUnitSet","NA",NA
"918","added in V2.0","2.0","fra","Groupe des bactéries diverses","2.0","Un groupe de mesures/méthodes relatives à diverses bactéries.","bactMisc","Les bactéries diverses sont souvent mesurées à des fins de normalisation ou de standardisation et n'ont qu'une seule mesure ou méthode. Lorsqu'une bactérie possède de nombreuses mesures, elle se verra attribuer son propre groupID dans les versions actualisées du dictionnaire.",NA
"919","added in V2.0","2.0","fra","Battement de billes, extrait avec MP96","2.0","Extraction d'acide nucléique, généralement utilisée pour la fraction solide d'un échantillon d'eaux usées, en utilisant le battage de billes et en utilisant un MP96 pour l'extraction finale.","bbMP96","NA",NA
"920","added in V2.0","2.0","fra","bcov","2.0","Mesure de la quantité de coronavirus bovin.","bcov","NA",NA
"921","added in V2.0","2.0","fra","Cible de culture de coronavirus bovin","2.0","Le coronavirus bovin cultivé est utilisé comme cible de contrôle de l'efficacité de la récupération.","bcovCul","NA",NA
"922","added in V2.0","2.0","fra","Cible du vaccin bcov","2.0","Le vaccin contre le coronavirus bovin est utilisé comme cible de contrôle de l'efficacité de la récupération.","bcovVac","NA",NA
"923","added in V2.0","2.0","fra","Floculation d'extrait de bœuf","2.0","Floculation d'extrait de bœuf","beeExtractFloc","NA",NA
"924","added in V2.0","2.0","fra","Beta","2.0","B.1.351","beta","NA",NA
"925","added in V2.0","2.0","fra","Biologique","2.0","Organisme et substance biologique.","bio","NA",NA
"926","added in V2.0","2.0","fra","RCP numérique par émulsification de gouttelettes","2.0","Décrit une analyse RCP effectuée à l'aide de la technologie RCP d'émulsification numérique de gouttelettes de BioRad.","bioRadDdpcr","NA",NA
"927","depreciated","1.0","fra","Lien vers le fichier du réseau d'égouts","2.0","Un fichier contenant toute information additionnelle au sujet du réseau d'égouts associé é ce site d'échantillonnage (tous les formats sont acceptés).","blob","NA",NA
"928","added in V2.0","2.0","fra","Type de données BLOB (Binary Large Object)","2.0","Le type de données pour les données BLOB (Binary Large Object).","blob","Utilisé uniquement pour les entrées du dictionnaire relatives aux parties.",NA
"929","Issue #120","2.0","fra","Largeur de la couverture (>=5x la profondeur)","2.0","Positions dont la profondeur de lecture est supérieure ou égale à 5.","boc","Rapport en pourcentage des positions.",NA
"930","description wording, structure","1.1","fra","Demande biochimique d'oxygène carbonée sur 5 jours","2.0","La quantité d'oxygène utilisée pour la dégradation biochimique de la matière organique selon des procédures de laboratoire standard en cinq (5) jours en présence d'un inhibiteur de nitrification, exprimée en milligrammes par litre (mg/l).","bod5c","NA",NA
"931","description wording, structure","1.1","fra","Demande biochimique d'oxygène totale de 5 jours","2.0","Demande biochimique d'oxygène totale sur 5 jours.","bod5t","NA",NA
"932","added in V2.0","2.0","fra","Type de données booléennes","2.0","Le type de données pour les données booléennes/binaires.","boolean","Utilisé uniquement pour les entrées du dictionnaire relatives aux parties.",NA
"933","added in V2.0","2.0","fra","Ensemble de valeurs booléen","2.0","L'ensemble qui contient les valeurs possibles valides pour une mesure booléenne (VRAI ou FAUX).","booleanSet","NA",NA
"934","added in V2.0","2.0","fra","Groupe du virus respiratoire syncytial bovin","2.0","Indique un groupe de mesures/méthodes liées au virus respiratoire syncytial bovin.","brsv","NA",NA
"935","added in V2.0","2.0","fra","VRSB culture Spike Target","2.0","Le virus respiratoire syncytial bovin (VRSB) cultivé est utilisé comme cible de contrôle de l'efficacité de la récupération.","brsvCul","NA",NA
"936","added in V2.0","1.0","fra","VRSB-N","2.0","VRSB-N","brsvN","NA",NA
"937","added in V2.0","2.0","fra","Cible du vaccin VRSB","2.0","Le vaccin contre le virus respiratoire syncytial bovin (VRSB) est utilisé comme cible de contrôle de l'efficacité de la récupération.","brsvVac","NA",NA
"938","NA","2.0","fra","Objectif","2.0","La raison pour laquelle la mesure ou l'échantillon a été prélevé.","purposeID","Voir les catégories autorisées : rapport, contrôle de qualité, étude de validation, test.",NA
"939","description wording, structure","1.0","fra","ID du polygone","2.0","Identifiant unique du polygone.","polygonID","NA",NA
"940","added in V2.0","2.0","fra","Ensemble d'unités de capacité","2.0","Ensemble d'unités pour les mesures de capacité.","capacityUnitSet","NA",NA
"941","added in V2.0","2.0","fra","Type de données catégorique","2.0","Le type de données pour les données catégoriques.","categorical","Utilisé uniquement pour les entrées du dictionnaire relatives aux parties.",NA
"942","added in V2.0","2.0","fra","CatSetégories","2.0","Une catégorie d'une mesure, d'une méthode ou d'un attribut.","category","Un exemple d'utilisation des catégories serait la façon dont elles sont utilisées pour enregistrer le site où une mesure est prise (partID = geoType). Pour l'attribut geoType, il existe différents types de sites où des échantillons peuvent être prélevés : une station de traitement des eaux usées, un réservoir d'avion, une station de pompage des eaux usées, etc. Chacun de ces types de sites est enregistré comme une catégorie qui peut être identifiée dans categorySetID = geoTypeCatSets.",NA
"943","added in V2.0","2.0","fra","Type de partie de l'ensemble de catégories","2.0","Le type de partie pour les ensembles de catégories.","catSet","Utilisé uniquement pour les entrées du dictionnaire relatives aux parties.",NA
"944","added in V2.0","2.0","fra","ID d'échelle d'agrégation","2.0","Une échelle utilisée pour une agrégation. Voir partID = ...","aggScaleID","NA",NA
"945","description wording, structure","1.0","fra","Type de site","2.0","Type de site ou d'institution du site d'échantillonnage.","siteTypeID","NA",NA
"946","added in version 2","2.0","fra","Bassin d'échantillonnage","2.0","Une zone géographique, un espace physique ou une structure. Un échantillon est prélevé dans un bassin d'échantillonnage pour une mesure représentative d'une ou plusieurs substances.","samshed","Exemples : Avion, maison de soins de longue durée, quartier, campus universitaire, municipalité.",NA
"947","added in V2.0","2.0","fra","ID de l'adresse","2.0","Un identifiant unique pour une adresse.","addID","NA",NA
"948","description wording, structure","1.0","fra","ID du site","2.0","Identifiant unique pour l'échantillon. Suggestion:siteID-date-index.","siteID","NA",NA
"949","description wording additional categories added (from NWSS)","1.0","fra","Matériel d'échantillonnage","2.0","Type d'échantillon.","saMaterial","NA",NA
"950","description wording.","1.1","fra","Degrés Celsius","2.0","Températures en degrés Celsius.","cel","NA",NA
"951","added in V2.0","2.0","fra","Centrifugation","2.0","Décrit la séparation solide d'un échantillon d'eau usée par centrifugation. Probablement lié à d'autres étapes de la méthode avant l'analyse.","cent","NA",NA
"952","added in V2.0","2.0","fra","Ultrafiltration Centricon","2.0","Ultrafiltration Centricon.","centriconUf","NA",NA
"953","added in V2.0","2.0","fra","Nanotrap Ceres","2.0","Nanotrap Ceres.","ceres","NA",NA
"954","description wording.","1.0","fra","UFC par 100 ml","2.0","Unités formatrices de colonies par 100 millilitres.","cfu","NA",NA
"955","added in V2.0","2.0","fra","ID de l'ensemble d'agrégation","2.0","L'ID d'un ensemble d'agrégations. S'applique principalements aux ""partType = units"".","aggSetID","NA",NA
"956","added in V2.0","2.0","fra","Chimique","2.0","Substanche chimique.","che","NA",NA
"957","added in V2.0","2.0","fra","Trousse chemagic d'adn/rna virale 300","2.0","Extraction d'acides nucléiques réalisée à l'aide de la trousse chemagic viral dna/rna 300.","chemVir","NA",NA
"958","changed to a relationshipID value.","1.0","fra","Article","2.0","Indique que l'échantillon est liée à des sous-échantillons (soit parce qu'il s'agit d'un échantillon combiné ou parce que des sous-échantillons ont été prélevés dans cet échantillon).","child","NA",NA
"959","description wording, structure","1.0","fra","Avion","2.0","Avion.","airpln","NA",NA
"960","NA","1.0","fra","Échantillon clarifié","2.0","Échantillon clarifié","clari","NA",NA
"961","added in V2.0","2.0","fra","Classe","2.0","Une classe est une collection d'une ou plusieurs mesures ou méthodes liées au sein d'un groupe. Un groupe peut avoir une ou plusieurs classes pour décrire différentes parties de la classe.","class","Voir partID = classID.",NA
"962","added in V2.0","2.0","fra","Nom de l'ensemble de données","2.0","Le nom de l'ensemble de données qui stocke les informations pour MeasureReport, SampleReport et d'autres tables de rapport.","datasetID","Dans la mesure du possible, le nom de l'identifiant de l'ensemble de données doit correspondre au dépositaire des données d'origine responsable de la production des données environnementales. (suggestion d'une convention de nom par défaut).",NA
"963","added in V2.0","2.0","fra","Nuageux","2.0","CatSetégorie qualitative pour la mesure météorologique, spécifiant un jour couvert sans pluie.","cloudy","NA",NA
"964","added in V2.0","2.0","fra","Centimètres","2.0","Partie d'unité pour l'unité SI de centimètres.","cm","NA",NA
"965","added in V2.0","2.0","fra","Dioxyde de carbone","2.0","Une mesure d'une quantité ou d'une concentration de dioxyde de carbone.","co2","NA",NA
"966","description wording, structure","1.0","fra","DCO","2.0","Demande chimique en oxygéne","cod","NA",NA
"967","added in V2.0","2.0","fra","Groupe de collection","2.0","Un groupe d'attributs de type mesure liés à la collecte d'échantillons.","colGrp","NA",NA
"968","added in V2.0","2.0","fra","Ensemble de catégories pour les instruments.","2.0","Liste des instruments utilisés pour les mesures et les méthodes","insTypeCatSet","NA",NA
"969","added in V2.0","2.0","fra","ID du rapport de l'ensemble de mesures","2.0","Identifiant unique permettant de relier un groupe de mesures reliées entre elles.","meaureSetRepID","NA",NA
"970","NA","1.0","fra","Date-heure","2.0","Date à laquelle la mesure a été réalisée.","aDateStart","NA",NA
"971","description wording, structure","1.0","fra","Canalisation d'égout secondaire","2.0","Spécifie un type de site qui est un tuyau de collecte qui s'étend latéralement à d'autres lignes d'égout municipales, permettant le drainage dans l'égout principal.","bSwrPpl","NA",NA
"972","added in V2.0","2.0","fra","Échantillon co-localisé","2.0","Deuxième ou multiples échantillons prélevés au même endroit mais à un moment différent (eau, air) ou à un endroit proche (sol, sédiments). Envoyés en aveugle au laboratoire.","colocated","NA",NA
"973","depreciated","1.0","fra","Nom de la colonne","2.0","Nom de la colonne.","columnName","NA",NA
"974","Use grab with collection number (collectNum) = 3","1.0","fra","Échantillon composite de 3","2.0","Un échantillon composite composé de 3 échantillons ponctuels.","comp3","NA",NA
